{
  "schemaVersion": 1,
  "id": "example-source-alpha-governance-pointer",
  "domain": "governance/alpha",
  "status": "promoted",
  "title": "Source-alpha governance is maintained in the manifest",
  "summary": "The manifest owns GitHub source-alpha, MIT license, manual review, and branch-promotion policy; consult its source workflow and governance section.",
  "sources": ["docs/manifest"],
  "related": ["README.md", "SECURITY.md"],
  "updated": "2026-10-08"
}
